word	meaning	example	example_ja
aquaculture	fish farming	Aquaculture sounds fancy but involves a lot of wet socks.	水産養殖って聞こえはいいけど、びしょ濡れの靴下がつきもの。
aquatic	water-based	He dreams of owning an aquatic hamster race track.	彼の夢は水中ハムスター競技場を持つこと。
A rather than B	AじゃなくてB	I chose sleep rather than cleaning.	掃除ではなく睡眠を選んだ。
arbitrary	random	My playlist is so arbitrary it goes from Mozart to memes.	私のプレイリストはモーツァルトからミームまでランダム。
arbitrate	judge	He was asked to arbitrate the Great Pizza Topping Debate.	彼は壮絶なピザのトッピング論争の仲裁を頼まれた。
archaeology	study of ancient things	I studied archaeology and dug up 300 pens from my room.	考古学を学び、自分の部屋からペンを300本発掘した。
ardour	passion	He spoke of instant noodles with unusual ardour.	彼はカップ麺について異様な情熱を語った。
argue	disagree	My siblings argue about whose turn it is to do nothing.	兄弟たちは「今日は誰が何もしない番か」で口論する。
arise	happen	Problems arise when snacks disappear mysteriously.	お菓子が謎に消えると問題が発生する。
arithmetic	math	Basic arithmetic fails when snacks are involved.	お菓子が絡むと算数が崩壊する。
army	military	My snack army stands ready—mostly made of chocolate.	私のスナック軍は出撃準備完了。主にチョコでできている。
arouse	trigger	The smell of toast can arouse ancient breakfast cravings.	トーストの香りは古代の朝ごはん欲を呼び起こす。
arrange for ~	set up	I’ll arrange for snacks at the meeting. That’s the real agenda.	会議用にお菓子を用意しておきます。それが本当の議題。
arrangement	plan	The seating arrangement put me next to the snack table.	席の配置がスナックテーブルの隣だった。
array	collection	She owns an impressive array of mugs with cat faces.	彼女は猫の顔がついたマグカップを大量に持っている。
arrogance	too much pride	His arrogance was so big, it needed its own chair.	彼の偉そうな態度は椅子ひとつ分の大きさだった。
artefact	old thing made by people	The artefact looked ancient—and slightly like a coffee mug.	その遺物は古く見えたが、どことなくマグカップに似ていた。
arthritis	joint disease	She has arthritis, so her fingers complain every morning.	彼女は関節炎なので、朝になると指が文句を言う。
articulate	speak clearly	He can articulate his ideas better than most adults.	彼は多くの大人よりも自分の考えをはっきり言える。
artifice	trick	That shortcut was pure artifice—and took twice as long.	その近道は完全なごまかしだった。かえって時間がかかった。
artificial	not real	This flower is so artificial, it smells like plastic.	この花は人工的すぎて、プラスチックのにおいがする。
artisan	craft worker	The artisan made the bowl by hand, with love and a few mistakes.	その職人は愛情と少しのミスを込めて手作りの器を作った。
as a matter of fact	in fact	As a matter of fact, I did my homework—just not all of it.	実は宿題やったよ。全部じゃないけど。
as a result	so	He forgot his umbrella. As a result, his hair became modern art.	彼は傘を忘れた。その結果、髪型が現代アートになった。
as a rule	usually	As a rule, I don’t trust group chats after midnight.	基本的に、深夜のグループチャットは信用していない。
as a token of ~	as a sign of ~	He gave her a pencil as a token of peace.	彼は仲直りの印として鉛筆をあげた。
as a whole	overall	As a whole, the movie was great—except for the plot, acting, and ending.	全体としてその映画は良かった。ストーリーと演技と結末を除けば。
ascertain	find out	We tried to ascertain who left the door open. No one confessed.	誰がドアを開けっぱなしにしたのか確かめようとしたが、誰も白状しなかった。
ascribe	say the reason is ~	They ascribe his energy to coffee. It’s mostly chaos.	彼の元気の理由はコーヒーだと言われているが、実際は混沌だ。
ascribe A to B	think A happens because of B	She ascribed her success to hard work—not just lucky timing.	彼女は成功の理由を努力だと考えている。運の良さだけじゃなく。
as far as ~	about ~	As far as I know, cats don’t need alarm clocks.	私の知る限り、猫に目覚ましは不要だ。
as follows	like this	The rules are as follows: 1) Don’t panic. 2) Try. 3) Repeat.	ルールは次の通り：1）あわてない　2）やってみる　3）繰り返す。
as for~	about ~	As for that idea… let’s pretend we didn’t hear it.	そのアイデアについては…聞かなかったことにしよう。
as good as ~	almost ~	This game is as good as finished—unless someone presses “restart.”	このゲームはもう終わったも同然。誰かが「再開」を押さなければ。
a sheet of ~	one piece of ~	He gave me a sheet of paper with exactly one useful word.	彼は紙を一枚くれた。その中で使える言葉は1つだけだった。
ashore	onto land	They finally made it ashore, tired and full of new stories.	彼らはついに岸にたどり着いた。疲れていたが話のネタは満載だった。
as is often the case with ~	usually happens with ~	As is often the case with shortcuts, this one took longer.	近道にありがちなことだが、かえって時間がかかった。
as it were	so to speak	He was, as it were, the team’s “walking alarm clock.”	彼はいわばチームの「歩く目覚まし」だった。
ask a favour of ~	request help from ~	I’d like to ask a favour of you—but it doesn’t involve heavy lifting.	お願いがあるんだけど、重いものは運ばせないよ。
ask for ~	request	He asked for help but made it sound like a challenge.	彼は助けを求めたが、まるで挑戦状のようだった。
aspiring	hoping to be	She's an aspiring artist—her sketchbook is 90% dragons.	彼女は芸術家志望で、スケッチブックの9割がドラゴンの絵だ。
as regards ~	about	As regards the group project, no one remembers who started it.	グループ課題については、誰が始めたか誰も覚えていない。
assassinate	kill someone important	The movie hero tried to assassinate the villain—with a pie.	映画の主人公は敵を暗殺しようとした…パイで。
assault	attack	The report was so boring, it felt like a mental assault.	その報告書は退屈すぎて、頭を攻撃された気分になった。
assay	test or check	We assayed the idea by asking three people and a cat.	私たちはそのアイデアを3人と猫に聞いて試してみた。
assemble	bring together	We tried to assemble the shelf, but ended up with abstract art.	棚を組み立てようとしたが、できたのは抽象アートだった。
assent	agree	She gave a small nod of assent, mostly to end the meeting.	彼女は小さくうなずいた。同意というより会議を終わらせたくて。
assert	say strongly	He asserted he wasn’t wrong—just "creatively correct."	彼は自分が間違っていないと主張した。「創造的に正しい」だけだと。
assess	judge or check	We assessed the mess and called it "organized chaos."	私たちはその散らかりを見て「整理されたカオス」と判断した。
asset	useful thing	Her ability to stay calm during panic is a real asset.	パニック中に冷静でいられる能力は本当に貴重だ。
assiduous	hard-working	He’s so assiduous, even his to-do list has a to-do list.	彼はとても勤勉で、ToDoリストにもToDoリストがある。
assign	give a task	The teacher assigned us homework before we could escape.	先生は私たちが逃げる前に宿題を出した。
assimilate	become like others	She assimilated fast—by learning memes and inside jokes.	彼女はすぐになじんだ。ミームと内輪ネタで。
associate	connect or link	I always associate rainy days with long naps.	雨の日といえば長い昼寝を思い出す。
assonance	repeating vowel sounds	The poem’s assonance made it flow like a sleepy song.	その詩の母音の響きは、まるで眠たくなる歌のようだった。
as such	in that way	He’s not a leader as such, but people follow his ideas.	彼はいわゆるリーダーではないが、皆が彼の考えについていく。
assumed	supposed	I assumed the test was easy. It was not.	そのテストは簡単だと思っていた。違った。
assurance	confidence or promise	He gave his assurance, but forgot 10 seconds later.	彼は自信満々に約束したが、10秒後には忘れていた。
asteroid	small space rock	The asteroid flew by Earth while everyone was watching cat videos.	小惑星は地球のそばを通過した。みんなが猫動画を見ている間に。
as the saying goes	as people often say	As the saying goes, “Better late than confusing.”	ことわざにあるとおり、「遅れても意味不明よりマシ」だ。
asthma	trouble with breathing	He blamed his slow run on asthma—and tight shoes.	彼は走るのが遅いのを喘息ときつい靴のせいにした。
as to ~	about	As to the missing cookies, I have no comment.	クッキーがなくなった件については、ノーコメントです。
astonishing	very surprising	Her room was astonishingly clean. I thought I was in the wrong house.	彼女の部屋が驚くほどきれいで、家を間違えたかと思った。
astray	lost or off track	My thoughts went astray after slide 2 of the presentation.	プレゼンの2枚目で私の思考は迷子になった。
astronaut	space traveler	The astronaut said zero gravity is fun—until lunchtime.	宇宙飛行士は無重力は楽しいと言っていた。昼ご飯までは。
astronomer	space scientist	The astronomer looked serious—until he found a typo in the stars.	天文学者は真剣だった。星の中にスペルミスを見つけるまでは。
as usual	like always	As usual, he arrived late but with a good excuse.	いつも通り、彼は遅れてきたが言い訳は完璧だった。
~ as well	also	I brought my bag—and my bad mood as well.	カバンと一緒に、機嫌の悪さも持ってきた。
as yet	up to now	No one has, as yet, explained why the fire alarm smells like toast.	今のところ、火災報知器がトーストのにおいがする理由は誰も説明していない。
asylum	place of safety or care	He treated the library like an asylum from social interaction.	彼は図書館を人付き合いから逃れる避難所として扱っていた。
asymmetrical	not even	The drawing was asymmetrical, like it was nervous to be looked at.	その絵は非対称で、見られるのが苦手な感じだった。
at a glance	with a quick look	At a glance, the instructions looked easy. They were not.	一目見た限り、その説明は簡単そうだった。実際は違った。
at all times	always	The door must stay closed at all times—especially when it wants to open.	ドアは常に閉めておくこと。特に勝手に開きたがるときは。
at a loss	confused or unsure	I was at a loss when the printer asked me for “emotional support.”	プリンターに「心の支えが必要」と言われて困惑した。
at an end	finished	The semester was finally at an end. So was my energy.	学期がようやく終わった。私の体力も一緒に。
at any cost	no matter what	I must finish this game today, at any cost—even sleep.	このゲームは今日中にクリアする。睡眠を犠牲にしてでも。
at any moment	very soon	The teacher could call on me at any moment—so I looked busy.	先生がいつでも私を指名しそうだったので、忙しいフリをした。
at any rate	in any case	At any rate, the plan failed, but we learned… something.	とにかく、その計画は失敗したが、何かは学んだ。
at any time	whenever	You can join the meeting at any time, especially if you enjoy confusion.	いつでも会議に参加していいよ。混乱が好きなら特にね。
at a time	one by one	Please enter the room one at a time, unless you're synchronized.	1人ずつ入室してください。ただしシンクロしてるなら別。
at best	maybe, but not much	The result was a success at best, a disaster at worst.	結果はうまくいったとしてもせいぜい普通、悪く言えば惨事だった。
at ease	relaxed	He looked at ease—even though the fire drill just started.	彼はくつろいで見えた。避難訓練が始まったばかりなのに。
at face value	as it seems	Don’t take his “I’m fine” at face value—check the eye twitch.	彼の「大丈夫」はそのまま信じないで。まばたきの速さを見て。
at first	at the beginning	At first, the puzzle seemed easy. Then it laughed at me.	最初はパズルが簡単に見えた。でも途中からバカにされてる気がした。
at first hand	from personal experience	I learned at first hand that cats hate water. Lesson burned.	猫が水を嫌うことは身をもって知った。傷ももらった。
at first sight	immediately	At first sight, the room looked clean. Then I opened the closet.	一目見た限り部屋はきれいだった。クローゼットを開けるまでは。
at hand	nearby or soon	The test is at hand, and so is the feeling of regret.	テストが近い。そして後悔もすぐそこだ。
at heart	inside, really	He acts tough, but at heart he loves cartoons.	彼は強がってるけど、本当はアニメが大好きだ。
athlete	sport player	She trains like an athlete—even for board games.	彼女はボードゲームですらアスリートのようにトレーニングする。
at issue	being discussed	The real problem at issue is who ate the last donut.	今の議題は、誰が最後のドーナツを食べたかだ。
at large	not caught or free	The cat is still at large, probably planning its next move.	その猫はいまだ逃走中。たぶん次の一手を考えている。
at last	finally	At last, the internet came back. Cheers were heard everywhere.	ついにインターネットが復活した。あちこちから歓声が上がった。
at least	not less than	I didn’t win, but at least I remembered my name.	勝てなかったが、名前を忘れなかっただけマシだ。
at leisure	in a relaxed way	He read the manual at leisure—after breaking everything.	彼はゆっくり説明書を読んだ。すべて壊した後に。
at length	for a long time	She talked at length about frogs. I stopped understanding halfway.	彼女はカエルについて長々と語った。途中から理解不能だった。
atmosphere	the feeling in a place	The café had a nice atmosphere, until the karaoke started.	そのカフェはいい雰囲気だった。カラオケが始まるまでは。
atomise	break into small pieces	The plan atomised the moment three people had opinions.	3人が意見を言い出した瞬間、その計画は粉々になった。
at once	right away	He stood up at once when he heard “cake.”	「ケーキ」と聞いた瞬間、彼は即座に立ち上がった。
at one's best	in top condition	She’s at her best when she’s not being watched.	彼女は見られていないときが一番力を発揮する。
at one's convenience	when it’s good for you	Please reply at your convenience—next year is fine too.	ご都合のいい時に返信ください。来年でも大丈夫です。
at one's wits' end	very confused or stressed	I was at my wits’ end when the printer said “offline” again.	プリンターがまた「オフライン」と言った時、私は限界だった。
at short notice	with little warning	The class was moved at short notice, and my brain didn’t get the memo.	授業は急に変更されたが、私の脳には伝わっていなかった。
at present	now	At present, I’m calm. But the group chat hasn’t replied yet.	今は落ち着いてる。でもグループチャットはまだ既読無視。
at random	without order	He chose the answer at random and still got it right. Lucky guess.	彼は適当に答えを選んだが正解した。運だけで。
atrophy	weaken over time	My ability to talk to people atrophied after one long weekend.	たった一回の長い週末で、会話力が衰えた。
attach	connect or add	Don’t forget to attach the file this time. Seriously.	今度こそファイルの添付を忘れないで。マジで。
attain	reach or get	He attained level 100 in the game, but forgot to eat lunch.	彼はゲームでレベル100に到達したが、昼ご飯を忘れていた。
attempt	try	I attempted to stay focused. Then came the cat.	集中しようとした。でも猫が来た。
attest	prove or confirm	I can attest that this chair is dangerous—ask my back.	この椅子が危険なのは証明できる。私の背中が語っている。
at the age of ~	when ~ years old	At the age of 9, he started coding. At 10, he broke the Wi-Fi.	9歳で彼はコーディングを始め、10歳でWi-Fiを壊した。
at the back of ~	behind ~	There’s a weird smell coming from the back of the fridge.	冷蔵庫の奥から、なんか変な匂いがしてる。
at the cost of ~	with loss of ~	She got full marks—at the cost of two all-nighters.	彼女は満点を取った。その代償は徹夜2回。
at the mercy of ~	controlled by ~	We were at the mercy of the autocorrect. It betrayed us all.	オートコレクトに支配されていた。全員裏切られた。
at the minute	at the moment	I’m not hungry at the minute. That could change in 5 minutes.	今はお腹すいてないけど、5分後はわからない。
at the risk of ~	maybe causing ~	At the risk of sounding lazy—I think this chair is too far.	怠け者っぽく聞こえるかもしれないけど、この椅子遠すぎる。
at the same time	together	He laughed and sneezed at the same time. Impressive.	彼は笑いながらくしゃみをした。同時に。すごい。
at the sight of ~	when seeing ~	At the sight of the pop quiz, the whole class froze.	抜き打ちテストを見た瞬間、クラス全体が固まった。
at the top of one's voice	very loudly	She sang at the top of her voice. The windows filed a complaint.	彼女は全力で歌った。窓が苦情を言いそうな勢いだった。
at this rate	if it continues like this	At this rate, we’ll be ready by 2050. Maybe.	このペースだと準備が整うのは2050年。たぶん。
attitude	the way you think or feel	His attitude toward Mondays is basically self-defense.	彼の月曜日への態度は、ほぼ自己防衛。
attribute A to B	say A is because of B	She attributes her success to effort—and good headphones.	彼女は成功の理由を努力と良いヘッドホンだと言っている。
awaken	wake up or notice	He finally awakened to the truth: his plant was plastic.	彼はようやく気づいた。自分の植物がプラスチックだったことに。
award	prize or gift	She got an award for being helpful—and always having pens.	彼女は親切さと、いつもペンを持っていることが評価されて表彰された。
awareness	knowing something	His awareness of deadlines is strong—right after they pass.	彼の締切への意識は高い。過ぎたあとに。
a week from today	7 days later	A week from today, I’ll be better—or still procrastinating.	1週間後には成長している…か、まだ先延ばししてるかだ。
awkward	embarrassing or weird	There was an awkward silence after I said “You too” to “Happy Birthday.”	「誕生日おめでとう」に「君もね」と返して、気まずい沈黙が流れた。
awry	not right or messed up	Our plan went awry when someone brought glitter.	誰かがラメを持ち込んだ時点で、計画は狂った。
axis	center line	The Earth spins on its axis—and so does my attention.	地球は軸で回っている。私の集中力も同じくらい不安定だ。
bait	something to attract	The discount was bait—and I walked right into the store.	割引はエサだった。そして私はまんまと店に入った。
balance	evenness or control	I tried to keep my balance—and my dignity—on the ice.	氷の上でバランスと尊厳を同時に保とうとした。
balk	refuse to do something	He balked at cleaning his room. The mess didn’t.	彼は部屋の掃除を拒否した。散らかりはそうしなかった。
ban	forbid or stop	The school banned phones. Students discovered... books.	学校が携帯を禁止した。生徒たちは本を発見した。
bandage	cover for wounds	I used a bandage—not for the cut, but for emotional support.	絆創膏を貼った。傷のためじゃなく、心の支えとして。
bankrupt	out of money	He went emotionally bankrupt after one group presentation.	グループ発表一回で彼は感情的に破産した。
bankruptcy	failure with money	After buying 5 smoothies, I declared personal bankruptcy.	スムージー5本買ったあと、私は個人破産を宣言した。
barbed	having sharp points	The comment was barbed—polite words, sharp meaning.	そのコメントはトゲがあった。丁寧な言葉で鋭く刺すタイプ。
barely	almost not	I barely passed the test—thanks to question 10.	そのテストはギリギリ合格した。第10問のおかげで。
barren	empty or unable to grow	The field was so barren, even the weeds looked bored.	その土地はあまりに何もなくて、雑草さえ退屈そうだった。
barrister	lawyer (in court)	The barrister argued with style, logic, and dramatic finger-pointing.	その法廷弁護士は、論理と派手な指さしで戦った。
barter	trade without money	They bartered a sandwich for a pencil. Surprisingly fair.	彼らはサンドイッチと鉛筆を物々交換した。意外と平等だった。
basic	simple	He only learned the basic moves, but still looked cool dancing.	彼は基本的な動きしか覚えていなかったが、それでもダンスはかっこよかった。
basin	bowl	She filled the basin with water to wash her tiny army of toy ducks.	彼女はたくさんのアヒルのおもちゃを洗うため、洗面器に水を入れた。
basis	reason	The basis for his fear of math? A calculator that once hissed.	彼が数学を怖がる理由？昔、電卓が「シューッ」と音を立てたから。
bask	relax in warmth	The cat basked in the sun like it had just conquered the world.	その猫は、まるで世界を征服したかのように日差しを浴びていた。
be above ~ ing	feel too good to ~	She’s above arguing online—unless it’s about pineapple on pizza.	彼女はネットで口論するほど暇じゃない。ピザにパイナップルが乗ってない限り。
be absorbed in ~	be really into ~	He was absorbed in his book and didn’t notice his soup was gone.	彼は本に夢中で、スープが消えたのに気づかなかった。
be abundant in ~	have a lot of ~	This island is abundant in coconuts and mosquito drama.	この島はココナッツと蚊騒動が豊富にある。
be accustomed to ~	be used to ~	She’s accustomed to cold showers—thanks to a broken heater.	彼女は冷たいシャワーに慣れている。壊れた給湯器のおかげで。
be acquainted with ~	know a little about ~	I'm acquainted with chess—mainly how to lose it quickly.	チェスのことはちょっと知ってる。特に、すぐ負ける方法について。
be adept at ~	be good at ~	He’s adept at fixing computers… and breaking them first.	彼はパソコン修理が得意だ。まず壊すところから始めるけど。
be afraid of ~	scared of ~	She’s afraid of spiders, especially ones that seem too confident.	彼女はクモが怖い。特に自信満々なやつは。
be against ~	disagree with ~	He’s against eating dessert first, but he still does it anyway.	彼はデザートを先に食べるのに反対してるけど、結局やる。
beak	bird nose	The parrot tapped the window with its beak like it owned the place.	オウムがくちばしで窓をトントンした。まるで自分の家かのように。
be all ears	listening carefully	I’m all ears—unless snacks are involved, then I’m also all hands.	話すなら聞くよ。お菓子が出たら、手も出すけどね。
be (all) Greek to ~	not understandable to ~	I tried to read the manual, but it was all Greek to me.	説明書を読もうとしたが、まるで外国語だった。
beam	shining smile	She beamed when she saw the cake—like it was her long-lost friend.	彼女はケーキを見てにっこり笑った。まるで旧友に再会したかのように。
be a match for ~	equal in ability to ~	He’s a match for his big brother—at least in video games.	彼は兄に匹敵する。少なくともゲームでは。
be anxious about ~	worried about ~	She’s anxious about the test… and the suspicious cat staring at her.	彼女はテストが不安だ。そしてじっと見てくる猫も。
be anxious for ~	want ~ badly	She was anxious for summer break like a cactus craves rain.	彼女は夏休みを心から待ち望んでいた。まるでサボテンが雨を待つように。
be anxious to	want to	He’s anxious to join the team—even if he can’t catch a ball.	彼はチームに入りたくてたまらない。ボールが取れなくても。
